<?xml version="1.0" encoding="UTF-8"?>
<xs:schema xmlns:xs="http://www.w3.org/2001/XMLSchema">
  <xs:element name="concesionario">
    <xs:complexType>
      <xs:sequence>
        <xs:element name="vehiculo" maxOccurs="unbounded">
          <xs:complexType>
            <xs:sequence>
              <xs:element name="marca" type="xs:string"/>
              <xs:element name="modelo" type="xs:string"/>
              <xs:element name="precio" type="xs:decimal"/>
              <xs:element name="descripcion" type="xs:string"/>
            </xs:sequence>
            <xs:attribute name="id" type="xs:integer" use="required"/>
          </xs:complexType>
        </xs:element>
      </xs:sequence>
    </xs:complexType>
  </xs:element>
</xs:schema>